{
  "schema_version": 2,
  "profile_id": "g1-v2",
  "scenario_root": "tools/issue-discovery/config/capacity/scenarios",
  "independently_assignable_gpus": 1,
  "freeze_point": "before-q0",
  "non_counted_actors": ["deterministic-controller"],
  "frozen_scenario_ids": [
    "b1-s1-g1",
    "b2-s1-g1",
    "b3-s1-g1",
    "b4-s1-g1",
    "b5-s1-g1",
    "b6-s1-g1",
    "b7-s1-g1",
    "b8-s1-g1",
    "serialized-reuse-a",
    "serialized-reuse-b",
    "b2-s2-g1",
    "b4-s2-g1",
    "b4-s3-g1",
    "b4-s4-g1"
  ],
  "stages": [
    {
      "stage_id": "observer-probe",
      "stage_class": "observer-probe",
      "scenario_binding": null,
      "execution_boundary": "readiness",
      "actor_trigger": "none",
      "optional": false,
      "actor_counts": {"observers": 1, "buyers": 0, "sellers": 0, "host_operators": 1},
      "load_counts": {"selected_listings": 0, "requests": 0},
      "independently_assignable_gpus": 1,
      "expected_outcomes": null,
      "retry_budget": 0,
      "admission": {"all_of": ["private-observer-readiness"], "any_of": []}
    },
    {
      "stage_id": "b1-s1-g1-reference",
      "stage_class": "reference",
      "scenario_binding": {"scenario_id": "b1-s1-g1", "scenario_path": "tools/issue-discovery/config/capacity/scenarios/b1-s1-g1.json", "scenario_sha256": "1b161cf35153b795a6af3941b18f0b6da9725f177d93945518e120bcb01f4b71"},
      "execution_boundary": "real-reference",
      "actor_trigger": "controller-driven",
      "optional": false,
      "actor_counts": {"observers": 1, "buyers": 1, "sellers": 1, "host_operators": 1},
      "load_counts": {"selected_listings": 1, "requests": 1},
      "independently_assignable_gpus": 1,
      "expected_outcomes": {"vm-succeeded": 1, "capacity-refused": 0, "fault": 0},
      "retry_budget": 0,
      "admission": {"all_of": ["observer-probe-complete", "deterministic-reference-authority", "verified-g1-topology"], "any_of": []}
    },
    {
      "stage_id": "b1-s1-g1-qualification",
      "stage_class": "qualification",
      "scenario_binding": {"scenario_id": "b1-s1-g1", "scenario_path": "tools/issue-discovery/config/capacity/scenarios/b1-s1-g1.json", "scenario_sha256": "1b161cf35153b795a6af3941b18f0b6da9725f177d93945518e120bcb01f4b71"},
      "execution_boundary": "real-qualification",
      "actor_trigger": "agent-triggered",
      "optional": false,
      "actor_counts": {"observers": 1, "buyers": 1, "sellers": 1, "host_operators": 1},
      "load_counts": {"selected_listings": 1, "requests": 1},
      "independently_assignable_gpus": 1,
      "expected_outcomes": {"vm-succeeded": 1, "capacity-refused": 0, "fault": 0},
      "retry_budget": 0,
      "admission": {"all_of": ["reference-complete", "verified-g1-topology"], "any_of": []}
    },
    {
      "stage_id": "b2-s1-g1-qualification",
      "stage_class": "qualification",
      "scenario_binding": {"scenario_id": "b2-s1-g1", "scenario_path": "tools/issue-discovery/config/capacity/scenarios/b2-s1-g1.json", "scenario_sha256": "46e0ff44baed6a1113471bd2e0c3dbf5fb7a50a6b24b43d2b948fff83ab7832c"},
      "execution_boundary": "real-qualification",
      "actor_trigger": "agent-triggered",
      "optional": false,
      "actor_counts": {"observers": 1, "buyers": 2, "sellers": 1, "host_operators": 1},
      "load_counts": {"selected_listings": 1, "requests": 2},
      "independently_assignable_gpus": 1,
      "expected_outcomes": {"vm-succeeded": 1, "capacity-refused": 1, "fault": 0},
      "retry_budget": 0,
      "admission": {"all_of": ["previous-stage-clean", "verified-g1-topology"], "any_of": []}
    },
    {
      "stage_id": "serialized-reuse-a-qualification",
      "stage_class": "qualification",
      "scenario_binding": {"scenario_id": "serialized-reuse-a", "scenario_path": "tools/issue-discovery/config/capacity/scenarios/serialized-reuse-a.json", "scenario_sha256": "7f18d2dba24aab8d88c55d117d5fd992bd6b5fc99d229853884d09df03715479"},
      "execution_boundary": "real-qualification",
      "actor_trigger": "agent-triggered",
      "optional": false,
      "actor_counts": {"observers": 1, "buyers": 1, "sellers": 1, "host_operators": 1},
      "load_counts": {"selected_listings": 1, "requests": 1},
      "independently_assignable_gpus": 1,
      "expected_outcomes": {"vm-succeeded": 1, "capacity-refused": 0, "fault": 0},
      "retry_budget": 0,
      "admission": {"all_of": ["previous-stage-clean", "verified-g1-topology"], "any_of": []}
    },
    {
      "stage_id": "serialized-reuse-b-qualification",
      "stage_class": "qualification",
      "scenario_binding": {"scenario_id": "serialized-reuse-b", "scenario_path": "tools/issue-discovery/config/capacity/scenarios/serialized-reuse-b.json", "scenario_sha256": "d34ebca49d58cf9b001e3c9143ce365553a18bc9c827c79a3a231cef6b49e063"},
      "execution_boundary": "real-qualification",
      "actor_trigger": "agent-triggered",
      "optional": false,
      "actor_counts": {"observers": 1, "buyers": 1, "sellers": 1, "host_operators": 1},
      "load_counts": {"selected_listings": 1, "requests": 1},
      "independently_assignable_gpus": 1,
      "expected_outcomes": {"vm-succeeded": 1, "capacity-refused": 0, "fault": 0},
      "retry_budget": 0,
      "admission": {"all_of": ["previous-stage-clean", "serialized-reuse-a-baseline-equivalent", "verified-g1-topology"], "any_of": []}
    },
    {
      "stage_id": "b2-s2-g1-qualification",
      "stage_class": "qualification",
      "scenario_binding": {"scenario_id": "b2-s2-g1", "scenario_path": "tools/issue-discovery/config/capacity/scenarios/b2-s2-g1.json", "scenario_sha256": "0c1135cfc21ac19f3cd3bc2a7795b08ddaa5e0e80f2a02a09623c7725057d23a"},
      "execution_boundary": "real-qualification",
      "actor_trigger": "agent-triggered",
      "optional": false,
      "actor_counts": {"observers": 1, "buyers": 2, "sellers": 2, "host_operators": 1},
      "load_counts": {"selected_listings": 2, "requests": 2},
      "independently_assignable_gpus": 1,
      "expected_outcomes": {"vm-succeeded": 1, "capacity-refused": 1, "fault": 0},
      "retry_budget": 0,
      "admission": {"all_of": ["previous-stage-clean", "verified-g1-topology", "distinct-seller-services-2"], "any_of": []}
    },
    {
      "stage_id": "q0-b1-s1-g1-measured",
      "stage_class": "measured",
      "scenario_binding": {"scenario_id": "b1-s1-g1", "scenario_path": "tools/issue-discovery/config/capacity/scenarios/b1-s1-g1.json", "scenario_sha256": "1b161cf35153b795a6af3941b18f0b6da9725f177d93945518e120bcb01f4b71"},
      "execution_boundary": "real-measured",
      "actor_trigger": "agent-triggered",
      "optional": false,
      "actor_counts": {"observers": 1, "buyers": 1, "sellers": 1, "host_operators": 1},
      "load_counts": {"selected_listings": 1, "requests": 1},
      "independently_assignable_gpus": 1,
      "expected_outcomes": {"vm-succeeded": 1, "capacity-refused": 0, "fault": 0},
      "retry_budget": 0,
      "admission": {"all_of": ["qualification-complete", "pre-q0-contract-frozen", "verified-g1-topology"], "any_of": []}
    },
    {
      "stage_id": "b2-s1-g1-measured",
      "stage_class": "measured",
      "scenario_binding": {"scenario_id": "b2-s1-g1", "scenario_path": "tools/issue-discovery/config/capacity/scenarios/b2-s1-g1.json", "scenario_sha256": "46e0ff44baed6a1113471bd2e0c3dbf5fb7a50a6b24b43d2b948fff83ab7832c"},
      "execution_boundary": "real-measured",
      "actor_trigger": "agent-triggered",
      "optional": false,
      "actor_counts": {"observers": 1, "buyers": 2, "sellers": 1, "host_operators": 1},
      "load_counts": {"selected_listings": 1, "requests": 2},
      "independently_assignable_gpus": 1,
      "expected_outcomes": {"vm-succeeded": 1, "capacity-refused": 1, "fault": 0},
      "retry_budget": 0,
      "admission": {"all_of": ["q0-complete", "previous-stage-clean", "verified-g1-topology"], "any_of": []}
    },
    {
      "stage_id": "b4-s1-g1-measured",
      "stage_class": "measured",
      "scenario_binding": {"scenario_id": "b4-s1-g1", "scenario_path": "tools/issue-discovery/config/capacity/scenarios/b4-s1-g1.json", "scenario_sha256": "38eade707650bba1f4a53c461ce9f9218e11c4dca15a7d49fefdac6afc873182"},
      "execution_boundary": "real-measured",
      "actor_trigger": "agent-triggered",
      "optional": false,
      "actor_counts": {"observers": 1, "buyers": 4, "sellers": 1, "host_operators": 1},
      "load_counts": {"selected_listings": 1, "requests": 4},
      "independently_assignable_gpus": 1,
      "expected_outcomes": {"vm-succeeded": 1, "capacity-refused": 3, "fault": 0},
      "retry_budget": 0,
      "admission": {"all_of": ["q0-complete", "previous-stage-clean", "verified-g1-topology"], "any_of": []}
    },
    {
      "stage_id": "b8-s1-g1-measured",
      "stage_class": "measured",
      "scenario_binding": {"scenario_id": "b8-s1-g1", "scenario_path": "tools/issue-discovery/config/capacity/scenarios/b8-s1-g1.json", "scenario_sha256": "1a170937e6a99662695113192f0859763ed586e12d079f5c205c5cc6eaf50b2e"},
      "execution_boundary": "real-measured",
      "actor_trigger": "agent-triggered",
      "optional": false,
      "actor_counts": {"observers": 1, "buyers": 8, "sellers": 1, "host_operators": 1},
      "load_counts": {"selected_listings": 1, "requests": 8},
      "independently_assignable_gpus": 1,
      "expected_outcomes": {"vm-succeeded": 1, "capacity-refused": 7, "fault": 0},
      "retry_budget": 0,
      "admission": {"all_of": ["q0-complete", "previous-stage-clean", "verified-g1-topology"], "any_of": []}
    },
    {
      "stage_id": "b3-s1-g1-measured",
      "stage_class": "measured",
      "scenario_binding": {"scenario_id": "b3-s1-g1", "scenario_path": "tools/issue-discovery/config/capacity/scenarios/b3-s1-g1.json", "scenario_sha256": "501ca2bd9c12414bc373fef1a181dade8d74a7801f387e28b01c372eea5b5b7f"},
      "execution_boundary": "real-measured",
      "actor_trigger": "agent-triggered",
      "optional": true,